"(u'big', u'name', u'investors', u'voicing', u'bitcoin', u'optimism', u'louder', u'negative', u'colleagues')","October 13, 2017"
"(u'nordic', u'law', u'firm', u'accepts', u'bitcoin', u'payments')","October 13, 2017"
"(u'zenapay', u'latest', u'pos', u'bitcoin', u'solution', u'enter', u'projected', u'billion', u'cannabis', u'market')","October 13, 2017"
"(u'remittance', u'startup', u'bitspark', u'drops', u'bitcoin', u'network', u'fees')","October 13, 2017"
"(u'fueled', u'bitcoin', u'fintech', u'booms', u'europe', u'banking', u'cartels', u'aim', u'slow.')","October 13, 2017"
"(u'markets', u'update', u'bitcoin', u'price', u'peaks', u'past', u'across', u'global', u'exchanges')","October 13, 2017"
"(u'uk', u'tickmill', u'adds', u'bitcoin', u'forex', u'platform')","October 12, 2017"
"(u'iranian', u'computer', u'hardware', u'company', u'accepts', u'bitcoin')","October 12, 2017"
"(u'swedish', u'officials', u'settle', u'first', u'debt', u'bitcoin')","October 12, 2017"
"(u'users', u'store', u'exchange', u'bitcoin', u'cash', u'via', u'blockchain', u'wallet')","October 12, 2017"
"(u'bitcoin', u'surges', u'past', u'usd', u'establish', u'new', u'all-', u'time', u'high')","October 12, 2017"
"(u'sec', u'unprepared', u'bitcoin', u'applications', u'denied', u'withdrawn', u'result')","October 12, 2017"
"(u'bitcoin.', u'org', u'publishes', u'list', u'businesses', u'miners', u'supporting', u'fork')","October 12, 2017"
"(u'south', u'korean', u'payment', u'app', u'toss', u'add', u'bitcoin', u'transactions')","October 12, 2017"
"(u'bitcoin', u'gold', u'project', u'responds', u'negative', u'criticism')","October 11, 2017"
"(u'japan', u'emerges', u'world', u'foremost', u'hotbed', u'bitcoin', u'trading')","October 11, 2017"
"(u'cambodia', u'first', u'bitcoin', u'point-', u'of-', u'sale', u'system', u'debuts', u'amid', u'currency', u'debate')","October 11, 2017"
"(u'panama', u'city', u'strip', u'mall', u'merchants', u'embrace', u'bitcoin', u'customers')","October 11, 2017"
"(u'two', u'bitcoin', u'startups', u'reveal', u'hard', u'fork', u'contingency', u'plans')","October 11, 2017"
"(u'roboforex', u'launches', u'cfd', u'trading', u'bitcoin')","October 10, 2017"
"(u'minimalist', u'family', u'sells', u'everything', u'bitcoin', u'hoping', u'pays')","October 10, 2017"
"(u'bitcoin', u'endures', u'instantaneous', u'flash', u'crash', u'major', u'price', u'index')","October 10, 2017"
"(u'pakistan', u'government', u'put', u'searchlight', u'bitcoin', u'traders', u'says', u'local', u'media')","October 10, 2017"
"(u'vanuatu', u'becomes', u'first', u'nation', u'accept', u'bitcoin', u'exchange', u'citizenship')","October 10, 2017"
"(u'markets', u'update', u'bitcoin', u'price', u'rocket', u'blasts')","October 10, 2017"
"(u'bitcoin', u'caught', u'attention', u'tanzania', u'central', u'bank')","October 9, 2017"
"(u'bitcoin', u'group', u'se', u'shares', u'skyrocket', u'along', u'bitcoin', u'ascent')","October 9, 2017"
"(u'texas', u'bitcoin', u'conference', u'coming', u'back', u'austin')","October 9, 2017"
"(u'car', u'sharing', u'firm', u'gets', u'million', u'adds', u'bitcoin', u'payments')","October 9, 2017"
"(u'fundstrat', u'global', u'advisors', u'create', u'bitcoin', u'indexes')","October 8, 2017"
"(u'altcoin', u'exchange', u'performs', u'first', u'atomic', u'swap', u'bitcoin', u'ethereum')","October 8, 2017"
"(u'music', u'streaming', u'service', u'arena', u'pays', u'royalties', u'bitcoin', u'eliminate', u'industry', u'black', u'box')","October 8, 2017"
"(u'bitcoin', u'atms', u'rise', u'russia')","October 8, 2017"
"(u'liberty', u'north', u'korea', u'bitcoin.', u'com', u'goldandblack', u'team', u'worthy', u'cause')","October 8, 2017"
"(u'bitcoin', u'cash', u'community', u'debates', u'future', u'difficulty', u'adjustments')","October 8, 2017"
"(u'bitcoin', u'illegal', u'nepal', u'police', u'arrest', u'seven', u'individuals', u'trading', u'operations')","October 7, 2017"
"(u'japan', u'largest', u'bitcoin', u'exchange', u'bitflyer', u'launches', u'bitcoin', u'visa', u'prepaid', u'card')","October 7, 2017"
"(u'england', u'use', u'left-', u'change', u'automatically', u'buy', u'bitcoin')","October 7, 2017"
"(u'etx', u'capital', u'deploys', u'bitcoin', u'cfd', u'trading', u'clients')","October 7, 2017"
"(u'bitcoin.', u'org', u'operators', u'aim', u'denounce', u'segwit', u'participants')","October 7, 2017"
"(u'markets', u'update', u'bitcoin', u'price', u'pops', u'higher', u'meets', u'upper', u'resistance')","October 6, 2017"
"(u'swiss', u'vocational', u'school', u'lucerne', u'university', u'accepts', u'bitcoin', u'tuition')","October 6, 2017"
"(u'mexico', u'proposes', u'legislation', u'tame', u'bitcoin')","October 6, 2017"
"(u'welto', u'integrates', u'coinbase', u'users', u'pay', u'bills', u'bitcoin')","October 6, 2017"
"(u'ecb', u'considers', u'legal', u'restraints', u'bitcoin', u'says', u'council', u'member')","October 6, 2017"
"(u'brazil', u'largest', u'brokerage', u'creates', u'xp', u'bitcoin')","October 5, 2017"
"(u'japan', u'finance', u'industry', u'embraces', u'bitcoin', u'mining')","October 5, 2017"
"(u'bitcoin', u'software', u'wars', u'segwit', u'node', u'masking', u'opt-', u'replay', u'protection', u'merged')","October 5, 2017"
"(u'goldman', u'sachs', u'ceo', u'lloyd', u'blankfein', u'latest', u'exec', u'flirt', u'bitcoin')","October 5, 2017"
"(u'large', u'japanese', u'energy', u'supplier', u'adds', u'bitcoin', u'payments', u'discount')","October 4, 2017"
"(u'government', u'head', u'department', u'fired', u'mining', u'bitcoin', u'using', u'state-', u'owned', u'computers', u'crimea')","October 4, 2017"
"(u'nigerian', u'bitcoin', u'exchange', u'offers', u'services', u'african', u'nations')","October 4, 2017"
"(u'ross', u'ulbricht', u'bitcoins')","October 3, 2017"
"(u'sweden', u'largest', u'online', u'stockbroker', u'avanza', u'bank', u'adds', u'bitcoin', u'services')","October 3, 2017"
"(u'bitpay', u'sprints', u'towards', u'processing', u'bitcoin', u'payments', u'annually')","October 3, 2017"
"(u'goldman', u'sachs', u'contemplates', u'creating', u'new', u'bitcoin', u'trading', u'operation')","October 3, 2017"
"(u'chinese', u'bitcoin', u'exchanges', u'bid', u'farewell', u'crypto-', u'community')","October 3, 2017"
"(u'coinbase', u'co-', u'founder', u'eyes', u'new', u'zealand', u'bitcoin', u'market')","October 2, 2017"
"(u'bitcoin-', u'fueled', u'homeless', u'outreach', u'wins', u'appeal', u'county', u'officials')","October 2, 2017"
"(u'free', u'talk', u'live', u'co-', u'host', u'discusses', u'bitcoin', u'radio', u'ads', u'accepting', u'bitcoin', u'cash')","October 1, 2017"
"(u'bitcoin', u'core', u'developer', u'appeals', u'sec', u'regarding', u'bit')","October 1, 2017"
"(u'bitcoin', u'prices', u'skyrocket', u'zimbabwean', u'exchange', u'economic', u'turmoil')","October 1, 2017"
"(u'transnistria', u'allegedly', u'seeking', u'russian', u'investment', u'establish', u'bitcoin', u'farms')","October 1, 2017"
"(u'markets', u'update', u'bitcoin', u'prices', u'see', u'uptrend', u'weekend')","October 1, 2017"
"(u'closer', u'look', u'suspicious', u'activity', u'involved', u'bitcoin', u'gold', u'fork')","September 30, 2017"
"(u'japan', u'endorses', u'different', u'crypto', u'exchanges', u'turns', u'friendliest', u'asian', u'bitcoin', u'market')","September 30, 2017"
"(u'bitcoin', u'etf', u'holy', u'grail', u'another', u'firm', u'attempts', u'odds', u'sec')","September 29, 2017"
"(u'cayman', u'investment', u'forum', u'focuses', u'rise', u'bitcoin', u'failing', u'dollar')","September 29, 2017"
"(u'gmo', u'enables', u'bitcoin', u'cash', u'ether', u'trading', u'promotional', u'discounts')","September 29, 2017"
"(u'india', u'multi-', u'currency', u'exchange', u'list', u'bitcoin', u'cash', u'two', u'weeks')","September 29, 2017"
"(u'sec', u'review', u'etfs', u'based', u'exchange', u'traded', u'bitcoin', u'derivatives', u'exist')","September 29, 2017"
"(u'another', u'fork', u'bitcoin', u'gold', u'project', u'plans', u'fork', u'bitcoin', u'next', u'month')","September 28, 2017"
"(u'bahrain', u'may', u'adopt', u'bitcoin', u'issue', u'bonds', u'digital', u'currency')","September 28, 2017"
"(u'large', u'us', u'financial', u'exchange', u'forgoes', u'bitcoin', u'futures')","September 28, 2017"
"(u'bitcoin', u'cash', u'gains', u'infrastructure', u'midst', u'segwit', u'drama')","September 27, 2017"
"(u'localbitcoins', u'trading', u'volume', u'sets', u'new', u'global', u'all-', u'time', u'high')","September 27, 2017"
"(u'korea', u'starts', u'on-', u'site', u'inspections', u'bitcoin', u'exchanges')","September 27, 2017"
"(u'sunex', u'lets', u'members', u'purchase', u'solar', u'cells', u'distributes', u'profits', u'bitcoin', u'fiat')","September 27, 2017"
"(u'president', u'european', u'central', u'bank', u'within', u'power', u'prohibit', u'regulate', u'bitcoin')","September 26, 2017"
"(u'singapore-', u'based', u'bitcoin', u'startups', u'deal', u'bank', u'account', u'closures')","September 26, 2017"
"(u'localbitcoins', u'compensates', u'users', u'selling', u'bitcoin', u'cash', u'btc')","September 26, 2017"
"(u'patent', u'filing', u'suggests', u'bitcoin', u'exchanges', u'may', u'monitored')","September 26, 2017"
"(u'japan', u'financial', u'authority', u'begin', u'bitcoin', u'exchange', u'surveillance', u'next', u'month')","September 26, 2017"
"(u'slovenian', u'savings', u'bank', u'traditional', u'atm', u'dispenses', u'bitcoin', u'vouchers')","September 25, 2017"
"(u'bitcoin', u'software', u'wars', u'case', u'replay', u'attack', u'protection')","September 25, 2017"
"(u'history', u'bitcoin.', u'com', u'introduction', u'new', u'company', u'blog')","September 24, 2017"
"(u'regulations', u'round-', u'bitcoin', u'bad', u'ukraine', u'indonesia', u'icos', u'reviewed', u'thailand')","September 24, 2017"
"(u'apartments', u'turkey', u'available', u'purchase', u'using', u'bitcoin')","September 23, 2017"
"(u'toronto', u'firm', u'evolve', u'applies', u'bitcoin-', u'based', u'etf', u'canada')","September 23, 2017"
"(u'markets', u'update', u'bitcoin', u'price', u'consolidates', u'last', u'week', u'volatility')","September 23, 2017"
"(u'introduction', u'satoshi', u'revolution', u'new', u'book', u'wendy', u'mcelroy', u'exclusively', u'bitcoin.', u'com')","September 23, 2017"
"(u'india', u'government', u'agencies', u'still', u'concerns', u'bitcoin')","September 23, 2017"
"(u'bitpay', u'adds', u'bitcoin', u'cash', u'support', u'copay', u'wallet', u'insight', u'block', u'explorer')","September 22, 2017"
"(u'younger', u'americans', u'see', u'bitcoin', u'investment', u'opportunity', u'survey', u'says')","September 22, 2017"
"(u'venezuelans', u'turn', u'selling', u'in-', u'game', u'gold', u'bitcoin')","September 22, 2017"
"(u'bitnovo', u'offers', u'loaded', u'bitcoin', u'cards', u'fifty', u'spanish', u'carrefour', u'retail', u'stores')","September 22, 2017"
"(u'major', u'japanese', u'travel', u'agency', u'accepts', u'bitcoin', u'offers', u'bitcoin-', u'exclusive', u'deals')","September 21, 2017"
"(u'jamie', u'dimon', u'bitcoin', u'statements', u'reported', u'market', u'abuse', u'sweden')","September 21, 2017"
"(u'chinese', u'bitcoin', u'exchange', u'executives', u'allegedly', u'must', u'remain', u'china')","September 20, 2017"
"(u'bitcoin-', u'accepting', u'expedia', u'accelerate', u'global', u'expansion')","September 20, 2017"
"(u'bitcoin', u'software', u'wars', u'discussions', u'heat', u'november', u'hard', u'fork', u'approaches')","September 20, 2017"
"(u'bond', u'street', u'level', u'jeweler', u'samer', u'halimeh', u'ny', u'accepts', u'bitcoin')","September 19, 2017"
"(u'pirate', u'bay', u'founder', u'njalla', u'offers', u'anonymous', u'domain', u'registration', u'bitcoin')","September 19, 2017"
"(u'china', u'may', u'try', u'block', u'bitcoin', u'transactions', u'country')","September 19, 2017"
"(u'aliant', u'payment', u'systems', u'partners', u'bitpay', u'bringing', u'bitcoin', u'mainstream')","September 19, 2017"
"(u'regulations', u'push', u'chinese', u'bitcoin', u'volumes', u'otc', u'neighboring', u'countries')","September 18, 2017"
"(u'september', u'bitcoin', u'market', u'madness', u'panic', u'selling', u'fomo', u'ensues')","September 18, 2017"
"(u'south', u'africa', u'second', u'largest', u'supermarket', u'chain', u'pick', u'pay', u'trials', u'bitcoin', u'payments')","September 18, 2017"
"(u'bitcoin', u'cash', u'network', u'continues', u'grow', u'ambitious', u'roadmap')","September 18, 2017"
"(u'expert', u'seven', u'reasons', u'chinese', u'regulators', u'shut', u'bitcoin', u'exchanges')","September 17, 2017"
"(u'india', u'considers', u'issuing', u'bitcoin-', u'like', u'cryptocurrency', u'legal', u'tender')","September 17, 2017"
"(u'japan', u'fsa', u'approves', u'coincheck', u'bitcoin', u'exchange', u'registration')","September 17, 2017"
"(u'chinese', u'investors', u'trade', u'bitcoin', u'over-', u'the-', u'counter', u'via', u'telegram')","September 16, 2017"
"(u'boss', u'calls', u'bitcoin', u'fraud', u'jp', u'morgan', u'buys', u'dip')","September 16, 2017"
"(u'bitstamp', u'introduce', u'bitcoin', u'cash', u'trading', u'end', u'month')","September 16, 2017"
"(u'bitcoin', u'journalism', u'wanted', u'hiring')","September 16, 2017"
"(u'nebraska', u'ethics', u'board', u'allows', u'attorneys', u'accept', u'bitcoin')","September 16, 2017"
"(u'beijing', u'sets', u'deadlines', u'bitcoin', u'exchanges', u'customers', u'withdraw', u'funds', u'quickly')","September 16, 2017"
"(u'bitcoin', u'markets', u'rebound', u'chinese', u'exchanges', u'plan', u'close', u'operations')","September 15, 2017"
"(u'china', u'regulatory', u'crackdown', u'forces', u'bitcoin', u'exchange', u'closures')","September 15, 2017"
"(u'bitcoin', u'proponents', u'respond', u'jp', u'morgan', u'executive', u'statements')","September 14, 2017"
"(u'bitcoin', u'exchange', u'btcc', u'halt', u'trading', u'regulatory', u'storm', u'brews', u'china')","September 14, 2017"
"(u'gmo', u'invest', u'billion', u'yen', u'nm', u'nm', u'nm', u'dedicated.')","September 13, 2017"
"(u'chinese', u'bitcoin', u'exchanges', u'face', u'stricter', u'regulation', u'licensure')","September 13, 2017"
"(u'markets', u'update', u'bitcoin', u'breaks', u'sell-')","September 13, 2017"
"(u'crypto', u'users', u'lost', u'bitcoin', u'cash', u'sending', u'legacy', u'bitcoin', u'wallets')","September 13, 2017"
"(u'regulation', u'round-', u'blockchain', u'tech', u'lauded', u'china', u'icos', u'shunned', u'uk', u'bitcoin', u'revered.')","September 12, 2017"
"(u'bitcoin', u'bubble')","September 12, 2017"
"(u'ig', u'bringing', u'bitcoin', u'bitcoin', u'cash', u'ether', u'cfd', u'trading', u'mainstream')","September 12, 2017"
"(u'lead', u'developer', u'amaury', u'chet', u'discusses', u'future', u'bitcoin', u'cash')","September 11, 2017"
"(u'xero', u'offer', u'cross-', u'border', u'payments', u'bitcoin', u'partnership', u'veem')","September 11, 2017"
"(u'nm', u'asics', u'bring', u'bitcoin', u'mining', u'whole', u'new', u'level')","September 10, 2017"
"(u'bitcoin-', u'friendly', u'companies', u'enter', u'flying', u'taxi', u'business')","September 10, 2017"
"(u'bitcoin', u'trading', u'slows', u'china', u'booms', u'hong', u'kong', u'south', u'america')","September 10, 2017"
"(u'chiasso', u'switzerland', u'municipality', u'allow', u'citizens', u'pay', u'taxes', u'bitcoin')","September 10, 2017"
"(u'network', u'launches', u'bitcoin', u'cash', u'beta', u'adds', u'new', u'features')","September 9, 2017"
"(u'japan', u'entertainment', u'giant', u'dmm', u'launching', u'bitcoin', u'mining', u'farm', u'pool')","September 9, 2017"
"(u'korean', u'court', u'rules', u'bitcoin', u'cannot', u'confiscated')","September 9, 2017"
"(u'bitcoin', u'ira', u'adds', u'bitcoin', u'cash', u'litecoin', u'ethereum', u'retirement', u'accounts')","September 9, 2017"
"(u'us', u'politicians', u'want', u'tax', u'exemptions', u'bitcoin', u'purchases', u'less')","September 8, 2017"
"(u'professor', u'urges', u'new', u'zealand', u'government', u'develop', u'bitcoin', u'regulations')","September 8, 2017"
"(u'tel', u'aviv', u'gets', u'new', u'btm', u'bitcoin', u'museum', u'historical', u'bauhaus', u'center')","September 8, 2017"
"(u'japan', u'internet', u'giant', u'gmo', u'launching', u'bitcoin', u'mining', u'nm', u'chips')","September 8, 2017"
"(u'top', u'indian', u'bitcoin', u'exchange', u'integrates', u'blockchain', u'wallet')","September 8, 2017"
"(u'grayscale', u'contemplates', u'creating', u'another', u'entity', u'bitcoin', u'cash')","September 7, 2017"
"(u'payza', u'unveils', u'bitcoin', u'address', u'manager')","September 7, 2017"
"(u'canadian', u'securities', u'commission', u'grants', u'bitcoin', u'fund', u'manager', u'registration')","September 7, 2017"
"(u'chainside', u'launches', u'segwit-', u'compliant', u'python', u'bitcoin', u'library', u'btcpy')","September 6, 2017"
"(u'bitcoin.', u'com', u'added', u'bitcoin', u'cash', u'functionality', u'wallet', u'versions')","September 6, 2017"
"(u'luxury', u'dubai', u'high', u'rise', u'apartments', u'sold', u'bitcoin')","September 5, 2017"
"(u'russian', u'men', u'charged', u'illegal', u'banking', u'unlicensed', u'bitcoin', u'trading')","September 5, 2017"
"(u'stargroup', u'network', u'upgrades', u'bringing', u'bitcoin', u'australian', u'atms')","September 5, 2017"
"(u'bitcoin', u'nvidia', u'prices', u'soar', u'sync')","September 5, 2017"
"(u'internet', u'archive', u'overstock', u'hodl', u'bitcoin', u'revenue', u'donations')","September 4, 2017"
"(u'markets', u'update', u'bitcoin', u'price', u'dives', u'deeper', u'midst', u'ico', u'shakedown')","September 4, 2017"
"(u'south', u'korea', u'coinplug', u'launches', u'new', u'exchange', u'begins', u'trading', u'bitcoin', u'cash')","September 3, 2017"
"(u'google', u'says', u'russia', u'interest', u'bitcoin', u'mining', u'ethereum')","September 3, 2017"
"(u'markets', u'update', u'bitcoin', u'takes', u'dip', u'big', u'run')","September 2, 2017"
"(u'ukrainian', u'lawmakers', u'agree', u'settle', u'bitcoin', u'legal', u'status', u'weeks')","September 2, 2017"
"(u'another', u'time', u'high', u'bitcoin', u'breaks', u'usd', u'asian', u'exchanges')","September 2, 2017"
"(u'moscow', u'exchange', u'clarifies', u'bitcoin', u'trading', u'plans', u'conflicting', u'reports')","September 1, 2017"
"(u'bitcoin', u'foundation', u'department', u'justice', u'investigated')","September 1, 2017"
"(u'bitcoin', u'debit', u'cards', u'halt', u'service', u'non-', u'european', u'residents', u'due', u'visa', u'new', u'rules')","September 1, 2017"
"(u'bitcoin', u'cash', u'network', u'turns', u'one', u'month', u'old', u'continues', u'move', u'forward')","September 1, 2017"
"(u'pr', u'five', u'advantages', u'universa', u'blockchain', u'bitcoin', u'ethereum')","August 31, 2017"
"(u'bitcoin', u'becoming', u'popular', u'investment', u'middle-', u'class', u'americans')","August 30, 2017"
"(u'bitcore', u'nodes', u'switch', u'bitcoin', u'implementation', u'even', u'forks')","August 30, 2017"
"(u'australian', u'government', u'bitcoin', u'causing', u'organized', u'crime', u'proliferate')","August 30, 2017"
"(u'bitkan', u'launch', u'otc', u'bitcoin', u'cash', u'trading', u'via', u'mobile', u'app')","August 30, 2017"
"(u'russian', u'energy', u'corporations', u'discuss', u'partnerships', u'bitcoin', u'miners')","August 30, 2017"
"(u'u.', u's.', u'lawmakers', u'aim', u'protect', u'bitcoin', u'users', u'government', u'harassment')","August 29, 2017"
"(u'markets', u'update', u'bitcoin', u'skyrockets', u'setting', u'new', u'all-', u'time', u'high')","August 29, 2017"
"(u'engineers', u'demonstrate', u'zcash', u'bitcoin', u'atomic', u'swaps')","August 29, 2017"
"(u'russia', u'proposes', u'restricting', u'bitcoin', u'qualified', u'investors')","August 29, 2017"
"(u'cryptobuyer', u'install', u'costa', u'rica', u'first', u'bitcoin', u'atm')","August 29, 2017"
"(u'telegram', u'founder', u'believes', u'bitcoin', u'undermine', u'us', u'hegemony')","August 28, 2017"
"(u'saxo', u'bank', u'offers', u'bitcoin', u'exchange', u'traded', u'notes')","August 28, 2017"
"(u'pro-', u'bitcoin', u'expedia', u'ceo', u'picked', u'run', u'uber')","August 28, 2017"
"(u'japan', u'largest', u'rewards', u'site', u'operator', u'million', u'users', u'launching', u'bitcoin', u'exchange')","August 28, 2017"
"(u'long', u'short', u'bitcoin', u'etfs', u'filed', u'sec')","August 27, 2017"
"(u'irs', u'may', u'consider', u'bitcoin', u'cash', u'fork', u'taxable', u'income', u'year')","August 27, 2017"
"(u'bank', u'mexico', u'rejects', u'virtual', u'currency', u'legal', u'classification', u'bitcoin')","August 27, 2017"
"(u'new', u'bitcoin.', u'com', u'charts', u'bitcoin', u'ecosystem', u'glance')","August 27, 2017"
"(u'vietnam', u'prepares', u'analyze', u'legal', u'framework', u'bitcoin')","August 26, 2017"
"(u'brokers', u'introduce', u'bitcoin', u'cash', u'cfd', u'trading')","August 25, 2017"
"(u'bitcoin', u'cash', u'becomes', u'longest', u'chain', u'miners', u'toggle', u'profits')","August 25, 2017"
"(u'bitfury', u'mines', u'segwit', u'block', u'larger', u'mb', u'bitcoiners', u'wait', u'network', u'relief')","August 25, 2017"
"(u'north', u'korea', u'could', u'targeting', u'bitcoin', u'exchanges', u'hacking', u'attack')","August 25, 2017"
"(u'sec', u'suspends', u'trading', u'bitcoin', u'firm', u'shares', u'price', u'jump')","August 25, 2017"
"(u'lightning', u'network', u'launches', u'third', u'release', u'featuring', u'bitcoin', u'litecoin', u'atomic', u'swaps')","August 25, 2017"
"(u'introducing', u'simple', u'use', u'robust', u'bitcoin.', u'com', u'wallet')","August 25, 2017"
"(u'researchers', u'profile', u'australian', u'bitcoin', u'user', u'male', u'white')","August 24, 2017"
"(u'large', u'korean', u'conglomerate', u'gets', u'bitcoin', u'remittances', u'post', u'legalization')","August 24, 2017"
"(u'chinese', u'bitcoin', u'exchanges', u'accused', u'misappropriating', u'client', u'funds')","August 24, 2017"
"(u'markets', u'update', u'bitcoin', u'price', u'pushes', u'forward', u'segwit', u'activation')","August 24, 2017"
"(u'congressional', u'candidate', u'accepts', u'bitcoin', u'donations', u'election', u'cycle')","August 24, 2017"
"(u'irs', u'crackdown', u'tracking', u'bitcoiners', u'chainalysis')","August 24, 2017"
"(u'segregated', u'witness', u'officially', u'activated', u'bitcoin', u'network')","August 24, 2017"
"(u'reward-', u'based', u'social', u'media', u'platform', u'switches', u'litecoin', u'bitcoin', u'cash')","August 23, 2017"
"(u'blockchain.', u'info', u'support', u'bitcoin', u'cash')","August 23, 2017"
"(u'central', u'bank', u'egypt', u'responds', u'first', u'bitcoin', u'exchange', u'launch')","August 22, 2017"
"(u'bitcoin', u'software', u'wars', u'battle', u'nodes', u'hashpower', u'developers')","August 22, 2017"
"(u'look', u'two', u'alternative', u'bitcoin', u'hardware', u'wallets', u'market')","August 22, 2017"
"(u'bitcoin', u'exchanges', u'filed', u'japanese', u'financial', u'authority')","August 22, 2017"
"(u'gibraltar', u'gets', u'first', u'bitcoin', u'atm', u'working', u'cryptocurrency', u'regulation')","August 21, 2017"
"(u'bitcoin', u'cash', u'commands', u'btc', u'total', u'hashrate')","August 21, 2017"
"(u'media', u'granted', u'access', u'bitmain', u'mongolian', u'bitcoin', u'mines')","August 21, 2017"
"(u'surbtc', u'launches', u'ethereum', u'bitcoin', u'trading', u'peru')","August 21, 2017"
"(u'university', u'research', u'project', u'analyzes', u'bitcoin', u'blockchain', u'combat', u'sex', u'trade')","August 20, 2017"
"(u'bitcoin', u'cash', u'mining', u'difficulty', u'drops', u'significantly', u'speeding', u'chain')","August 20, 2017"
"(u'bitcoin', u'mansion', u'sale', u'russia', u'hindered', u'lack', u'regulation')","August 20, 2017"
"(u'japan', u'largest', u'ticket', u'marketplace', u'million', u'users', u'accepts', u'bitcoin')","August 20, 2017"
"(u'grappling', u'championships', u'use', u'bitcoin', u'circumvent', u'censorship')","August 20, 2017"
"(u'zerolink', u'claims', u'developed', u'fully', u'anonymous', u'bitcoin', u'payments')","August 19, 2017"
"(u'markets', u'update', u'bitcoin', u'cash', u'rallies', u'three', u'solid', u'days')","August 19, 2017"
"(u'world', u'largest', u'bitcoin', u'exchange', u'bitflyer', u'expands', u'us', u'market')","August 19, 2017"
"(u'government', u'agencies', u'adopting', u'bitcoin', u'blockchain', u'technology')","August 18, 2017"
"(u'bitcoin', u'cash', u'flips', u'mining', u'profitability')","August 18, 2017"
"(u'segwit', u'bitcoin', u'core', u'drama', u'flares', u'community', u'tension')","August 18, 2017"
"(u'south', u'african', u'bitcoin', u'trading', u'sets', u'record', u'volume')","August 18, 2017"
"(u'pr', u'bitconnect', u'coin', u'bcc', u'hits', u'new', u'all-', u'time', u'high', u'bitcoin', u'price', u'surges')","August 18, 2017"
"(u'coinbase', u'receives', u'patent', u'new', u'bitcoin', u'security', u'measure')","August 18, 2017"
"(u'australia', u'introduces', u'bill', u'regulates', u'bitcoin', u'exchanges')","August 18, 2017"
"(u'trezor', u'calls', u'article', u'claims', u'break', u'bitcoin', u'hardware', u'wallets', u'fud')","August 17, 2017"
"(u'former', u'paypal', u'coo', u'david', u'sacks', u'discusses', u'bitcoin', u'argues', u'icos', u'threat', u'vcs')","August 17, 2017"
"(u'japanese', u'exchange', u'debuts', u'bitcoin', u'corporate', u'bond')","August 17, 2017"
"(u'search', u'volumes', u'bitcoin', u'ethereum', u'enter', u'inverse', u'correlation')","August 16, 2017"
"(u'bitcoin', u'cash', u'mb', u'block', u'clears', u'transactions')","August 16, 2017"
"(u'russian', u'lawmakers', u'delay', u'bitcoin', u'regulation', u'bill')","August 16, 2017"
"(u'three', u'ukrainian', u'lawmakers', u'declare', u'bitcoin', u'holdings', u'worth', u'million')","August 16, 2017"
